{
  "fixture_version": 1,
  "id": "layout_noise_only",
  "title": "Scrambled display with simple biology",
  "purpose": "Separates excess layout tangledness from intrinsic structure.",
  "species": [
    {
      "id": "sp1",
      "chromosomes": [
        {
          "id": "1",
          "length": 100,
          "blocks": [
            {
              "occurrence_id": "sp1:1:1",
              "homology_id": "H1",
              "start": 0,
              "end": 100,
              "strand": "+"
            }
          ],
          "display_rank": 1
        },
        {
          "id": "2",
          "length": 100,
          "blocks": [
            {
              "occurrence_id": "sp1:2:1",
              "homology_id": "H2",
              "start": 0,
              "end": 100,
              "strand": "+"
            }
          ],
          "display_rank": 2
        },
        {
          "id": "3",
          "length": 100,
          "blocks": [
            {
              "occurrence_id": "sp1:3:1",
              "homology_id": "H3",
              "start": 0,
              "end": 100,
              "strand": "+"
            }
          ],
          "display_rank": 3
        },
        {
          "id": "4",
          "length": 100,
          "blocks": [
            {
              "occurrence_id": "sp1:4:1",
              "homology_id": "H4",
              "start": 0,
              "end": 100,
              "strand": "+"
            }
          ],
          "display_rank": 4
        }
      ]
    },
    {
      "id": "sp2",
      "chromosomes": [
        {
          "id": "3",
          "length": 100,
          "blocks": [
            {
              "occurrence_id": "sp2:3:1",
              "homology_id": "H3",
              "start": 0,
              "end": 100,
              "strand": "+"
            }
          ],
          "display_rank": 1
        },
        {
          "id": "1",
          "length": 100,
          "blocks": [
            {
              "occurrence_id": "sp2:1:1",
              "homology_id": "H1",
              "start": 0,
              "end": 100,
              "strand": "+"
            }
          ],
          "display_rank": 2
        },
        {
          "id": "4",
          "length": 100,
          "blocks": [
            {
              "occurrence_id": "sp2:4:1",
              "homology_id": "H4",
              "start": 0,
              "end": 100,
              "strand": "+"
            }
          ],
          "display_rank": 3
        },
        {
          "id": "2",
          "length": 100,
          "blocks": [
            {
              "occurrence_id": "sp2:2:1",
              "homology_id": "H2",
              "start": 0,
              "end": 100,
              "strand": "+"
            }
          ],
          "display_rank": 4
        }
      ]
    }
  ],
  "orientation_constraints": [],
  "expected": {
    "chromosome_component_count": 4,
    "incidence_cycle_rank_total": 0,
    "initial_whole_chromosome_crossings": 3,
    "constrained_minimum_crossings": 0,
    "excess_layout_crossings_initial": 3,
    "hard_kernel_count": 0,
    "notes": "The biology is four independent 1:1 components. Applying one common component order removes all three display-induced crossings."
  }
}
