{
  "fixture_version": 1,
  "id": "ancestral_terminal_fusion",
  "title": "One terminal fusion",
  "purpose": "Simple ancestral-pruning proof of concept: three species retain separate H1/H2 chromosomes and one terminal species carries H1-H2 adjacent on a fused chromosome.",
  "species": [
    {
      "id": "sp1",
      "chromosomes": [
        {"id": "1", "length": 100, "blocks": [{"occurrence_id": "sp1:1:H1", "homology_id": "H1", "start": 0, "end": 100, "strand": "+"}], "display_rank": 1},
        {"id": "2", "length": 100, "blocks": [{"occurrence_id": "sp1:2:H2", "homology_id": "H2", "start": 0, "end": 100, "strand": "+"}], "display_rank": 2}
      ]
    },
    {
      "id": "sp2",
      "chromosomes": [
        {"id": "1", "length": 100, "blocks": [{"occurrence_id": "sp2:1:H1", "homology_id": "H1", "start": 0, "end": 100, "strand": "+"}], "display_rank": 1},
        {"id": "2", "length": 100, "blocks": [{"occurrence_id": "sp2:2:H2", "homology_id": "H2", "start": 0, "end": 100, "strand": "+"}], "display_rank": 2}
      ]
    },
    {
      "id": "sp3",
      "chromosomes": [
        {"id": "1", "length": 100, "blocks": [{"occurrence_id": "sp3:1:H1", "homology_id": "H1", "start": 0, "end": 100, "strand": "+"}], "display_rank": 1},
        {"id": "2", "length": 100, "blocks": [{"occurrence_id": "sp3:2:H2", "homology_id": "H2", "start": 0, "end": 100, "strand": "+"}], "display_rank": 2}
      ]
    },
    {
      "id": "sp4",
      "chromosomes": [
        {"id": "fusion12", "length": 200, "blocks": [
          {"occurrence_id": "sp4:fusion12:H1", "homology_id": "H1", "start": 0, "end": 100, "strand": "+"},
          {"occurrence_id": "sp4:fusion12:H2", "homology_id": "H2", "start": 100, "end": 200, "strand": "+"}
        ], "display_rank": 1}
      ]
    }
  ],
  "orientation_constraints": [],
  "expected": {
    "experiment": "ancestral_pruning",
    "species_tree": "((sp1,sp2),(sp3,sp4));",
    "expected_H1_H2_observations": {"sp1": 0, "sp2": 0, "sp3": 0, "sp4": 1},
    "expected_root_cost_absent": 1,
    "expected_root_cost_present": 2
  }
}
